[
  {
    "id": "masters-imperial-college-london",
    "universityId": "imperial-college-london",
    "labelZh": "查看全部硕士课程",
    "url": "https://www.imperial.ac.uk/study/courses/?courseType=postgraduate+taught",
    "pageTitle": "Course search | Study | Imperial College London",
    "reviewedAt": "2026-08-11",
    "requiredText": ["Find a course", "Postgraduate taught"],
    "monitorMode": "page-identity"
  },
  {
    "id": "masters-university-of-oxford",
    "universityId": "university-of-oxford",
    "labelZh": "查看全部硕士课程",
    "url": "https://www.ox.ac.uk/admissions/graduate/courses/find-your-course",
    "pageTitle": "Find your postgraduate course | Oxford University",
    "reviewedAt": "2026-08-11",
    "requiredText": ["Find your postgraduate course", "Use this search tool to explore all of Oxford's graduate courses."],
    "monitorMode": "page-identity"
  },
  {
    "id": "masters-university-of-cambridge",
    "universityId": "university-of-cambridge",
    "labelZh": "查看全部硕士课程",
    "url": "https://www.postgraduate.study.cam.ac.uk/courses",
    "pageTitle": "Course Directory | Postgraduate Study",
    "reviewedAt": "2026-08-11",
    "requiredText": ["Course Directory", "Use the Course Directory to search over 300 postgraduate courses at Cambridge."],
    "monitorMode": "page-identity"
  },
  {
    "id": "masters-university-college-london",
    "universityId": "university-college-london",
    "labelZh": "查看全部硕士课程",
    "url": "https://www.ucl.ac.uk/study/prospective-students/graduate",
    "pageTitle": "Graduate degrees | Study at UCL",
    "reviewedAt": "2026-08-11",
    "requiredText": ["Taught degrees", "Research degrees"],
    "monitorMode": "page-identity"
  },
  {
    "id": "masters-university-of-edinburgh",
    "universityId": "university-of-edinburgh",
    "labelZh": "查看全部硕士课程",
    "url": "https://study.ed.ac.uk/postgraduate",
    "pageTitle": "Postgraduate study | The University of Edinburgh",
    "reviewedAt": "2026-08-11",
    "requiredText": ["Browse the degree finder", "Search the degree finder"],
    "monitorMode": "page-identity"
  },
  {
    "id": "masters-kings-college-london",
    "universityId": "kings-college-london",
    "labelZh": "查看全部硕士课程",
    "url": "https://www.kcl.ac.uk/study/home?lang=en",
    "pageTitle": "Study | King's College London",
    "reviewedAt": "2026-08-11",
    "requiredText": ["Postgraduate taught", "Postgraduate research"],
    "monitorMode": "page-identity"
  },
  {
    "id": "masters-university-of-manchester",
    "universityId": "university-of-manchester",
    "labelZh": "查看全部硕士课程",
    "url": "https://www.manchester.ac.uk/study/",
    "pageTitle": "Study | The University of Manchester",
    "reviewedAt": "2026-08-11",
    "requiredText": ["Taught master's", "Postgraduate research"],
    "monitorMode": "page-identity"
  },
  {
    "id": "masters-university-of-bristol",
    "universityId": "university-of-bristol",
    "labelZh": "查看全部硕士课程",
    "url": "https://www.bristol.ac.uk/study/postgraduate/",
    "pageTitle": "Postgraduate study | Study at Bristol | University of Bristol",
    "reviewedAt": "2026-08-11",
    "requiredText": ["Find your programme", "Postgraduate study routes"],
    "monitorMode": "page-identity"
  },
  {
    "id": "masters-london-school-of-economics-and-political-science",
    "universityId": "london-school-of-economics-and-political-science",
    "labelZh": "查看全部硕士课程",
    "url": "https://www.lse.ac.uk/study-at-lse/Graduate",
    "pageTitle": "Graduate",
    "reviewedAt": "2026-08-11",
    "requiredText": ["Graduate study opportunities at LSE", "Available programmes"],
    "monitorMode": "page-identity"
  },
  {
    "id": "masters-university-of-warwick",
    "universityId": "university-of-warwick",
    "labelZh": "查看全部硕士课程",
    "url": "https://warwick.ac.uk/study/postgraduate/courses-2026/course-list/",
    "pageTitle": "course-list",
    "reviewedAt": "2026-08-11",
    "requiredText": ["Postgraduate Taught", "Postgraduate Research"],
    "monitorMode": "page-identity"
  },
  {
    "id": "masters-university-of-birmingham",
    "universityId": "university-of-birmingham",
    "labelZh": "查看全部硕士课程",
    "url": "https://www.birmingham.ac.uk/study/postgraduate",
    "pageTitle": "Postgraduate study & research at Birmingham - University of Birmingham",
    "reviewedAt": "2026-08-11",
    "requiredText": ["Postgraduate study or research", "over 600 taught postgraduate programmes"],
    "monitorMode": "page-identity"
  },
  {
    "id": "masters-university-of-leeds",
    "universityId": "university-of-leeds",
    "labelZh": "查看全部硕士课程",
    "url": "https://courses.leeds.ac.uk/courses/",
    "pageTitle": "Course Search | University of Leeds",
    "reviewedAt": "2026-08-11",
    "requiredText": ["Undergraduate and Masters course search", "Search for postgraduate research opportunities"],
    "monitorMode": "page-identity"
  },
  {
    "id": "masters-university-of-glasgow",
    "universityId": "university-of-glasgow",
    "labelZh": "查看全部硕士课程",
    "url": "https://www.gla.ac.uk/postgraduate/",
    "pageTitle": "University of Glasgow - Postgraduate study",
    "reviewedAt": "2026-08-11",
    "requiredText": ["Find a programme", "Postgraduate Research"],
    "monitorMode": "page-identity"
  },
  {
    "id": "masters-university-of-sheffield",
    "universityId": "university-of-sheffield",
    "labelZh": "查看全部硕士课程",
    "url": "https://sheffield.ac.uk/postgraduate",
    "pageTitle": "Postgraduate study | Postgraduate study | The University of Sheffield",
    "reviewedAt": "2026-08-11",
    "requiredText": ["Postgraduate study", "A masters or PhD at Sheffield"],
    "monitorMode": "page-identity"
  },
  {
    "id": "masters-durham-university",
    "universityId": "durham-university",
    "labelZh": "查看全部硕士课程",
    "url": "https://www.durham.ac.uk/study/postgraduate/",
    "pageTitle": "Postgraduate - Durham University",
    "reviewedAt": "2026-08-11",
    "requiredText": ["Postgraduate Taught degrees", "Postgraduate Research"],
    "monitorMode": "page-identity"
  },
  {
    "id": "masters-university-of-nottingham",
    "universityId": "university-of-nottingham",
    "labelZh": "查看全部硕士课程",
    "url": "https://www.nottingham.ac.uk/pgstudy/courses/courses.aspx",
    "pageTitle": "Postgraduate course search - The University of Nottingham",
    "reviewedAt": "2026-08-11",
    "requiredText": ["Postgraduate course search", "Taught Research All"],
    "monitorMode": "page-identity"
  },
  {
    "id": "masters-queen-mary-university-of-london",
    "universityId": "queen-mary-university-of-london",
    "labelZh": "查看全部硕士课程",
    "url": "https://www.qmul.ac.uk/postgraduate/",
    "pageTitle": "Postgraduate study - Queen Mary University of London",
    "reviewedAt": "2026-08-11",
    "requiredText": ["Masters programmes", "Research degrees"],
    "monitorMode": "page-identity"
  },
  {
    "id": "masters-university-of-southampton",
    "universityId": "university-of-southampton",
    "labelZh": "查看全部硕士课程",
    "url": "https://www.southampton.ac.uk/courses",
    "pageTitle": "CourseFinder | University of Southampton",
    "reviewedAt": "2026-08-11",
    "requiredText": ["Find your course", "Select study level"],
    "monitorMode": "page-identity"
  },
  {
    "id": "masters-university-of-st-andrews",
    "universityId": "university-of-st-andrews",
    "labelZh": "查看全部硕士课程",
    "url": "https://www.st-andrews.ac.uk/study/postgraduate/",
    "pageTitle": "Masters - Study at St Andrews - University of St Andrews",
    "reviewedAt": "2026-08-11",
    "requiredText": ["Masters study at St Andrews", "Research degrees"],
    "monitorMode": "page-identity"
  },
  {
    "id": "masters-university-of-bath",
    "universityId": "university-of-bath",
    "labelZh": "查看全部硕士课程",
    "url": "https://www.bath.ac.uk/courses/",
    "pageTitle": "Courses",
    "reviewedAt": "2026-08-11",
    "requiredText": ["Search for a course", "Postgraduate research"],
    "monitorMode": "page-identity"
  },
  {
    "id": "masters-university-of-exeter",
    "universityId": "university-of-exeter",
    "labelZh": "查看全部硕士课程",
    "url": "https://www.exeter.ac.uk/masters-degrees/",
    "pageTitle": "Masters Degrees and Courses | University of Exeter",
    "reviewedAt": "2026-08-11",
    "requiredText": ["Masters degrees and courses", "Search for a course"],
    "monitorMode": "page-identity"
  },
  {
    "id": "masters-university-of-liverpool",
    "universityId": "university-of-liverpool",
    "labelZh": "查看全部硕士课程",
    "url": "https://www.liverpool.ac.uk/courses/postgraduate-taught",
    "pageTitle": "Postgraduate taught | Courses | University of Liverpool",
    "reviewedAt": "2026-08-11",
    "requiredText": ["Our courses", "Postgraduate research"],
    "monitorMode": "page-identity"
  },
  {
    "id": "masters-newcastle-university",
    "universityId": "newcastle-university",
    "labelZh": "查看全部硕士课程",
    "url": "https://www.ncl.ac.uk/postgraduate/degrees/",
    "pageTitle": "Find a Degree | Postgraduate | Newcastle University",
    "reviewedAt": "2026-08-11",
    "requiredText": ["Find a Postgraduate Degree", "more than 300 postgraduate degrees"],
    "monitorMode": "page-identity"
  },
  {
    "id": "masters-university-of-york",
    "universityId": "university-of-york",
    "labelZh": "查看全部硕士课程",
    "url": "https://www.york.ac.uk/study/postgraduate/",
    "pageTitle": "Postgraduate - Postgraduate, University of York",
    "reviewedAt": "2026-08-11",
    "requiredText": ["Postgraduate taught", "Masters by research"],
    "monitorMode": "page-identity"
  },
  {
    "id": "masters-lancaster-university",
    "universityId": "lancaster-university",
    "labelZh": "查看全部硕士课程",
    "url": "https://www.lancaster.ac.uk/study/postgraduate/postgraduate-courses/",
    "pageTitle": "Postgraduate courses - Lancaster University",
    "reviewedAt": "2026-08-11",
    "requiredText": ["Postgraduate courses", "Find your course"],
    "monitorMode": "page-identity"
  },
  {